1.0.0	ACT I
1.3.46	True; who bears hard His brother's death at Bristol, the Lord Scroop. I speak not this in estimation, As what I think might be, but what I know Is ruminated, plotted and set down, And only stays but to behold the face Of that occasion that shall bring it on.
1.3.47	I smell it: upon my life, it will do well.
1.3.48	Before the game is afoot, thou still let'st slip.
1.3.49	Why, it cannot chose but be a noble plot: And then the power of Scotland and York, To join with Mortimer, ha?
1.3.50	And so they shall.
1.3.51	In faith, it is exceedingly well aim'd.
1.3.52	And 'tis no little reason bids us speed, To save our heads by raising of a head; For, bear ourselves as even as we can, The king will always think him in our debt, And think we think ourselves unsatisfied, Till he hath found a time to pay us home: And see already how he doth begin To make us strangers to his looks of love.
1.3.53	He does, he does: we'll be revenged on him.
1.3.54	Cousin, farewell: no further go in this Than I by letters shall direct your course. When time is ripe, which will be suddenly, I'll steal to Glendower and Lord Mortimer; Where you and Douglas and our powers at once, As I will fashion it, shall happily meet, To bear our fortunes in our own strong arms, Which now we hold at much uncertainty.
1.3.55	Farewell, good brother: we shall thrive, I trust.
1.3.56	Uncle, adieu: O, let the hours be short Till fields and blows and groans applaud our sport! [Exeunt.
2.0.0	ACT II
2.1.1	Rochester. An inn yard.
2.1.2	Enter a Carrier with a lantern in his hand.
2.1.3	Heigh-ho! an it be not four by the day, I'll be hanged: Charles' wain is over the new chimney, and yet our horse not packed. What, ostler!
2.1.4	[Within]
2.1.5	Anon, anon.
2.1.6	I prithee Tom, beat Cut's saddle, put a few flocks in the point; poor jade, is wrung in the withers out of all cess. Enter another Carrier.
2.1.7	Peas and beans are as dank here as a dog, and that is the next way to give poor jades the bots: this house is turned upside down since Robin Ostler died.
2.1.8	Poor fellow, never joyed since the price of oats rose; it was the death of him.
2.1.9	I think this is the most villanous house in all London road for fleas: I am stung like a tench.
2.1.10	Like a tench! by the mass, there is ne'er a king christen could be better bit than I have been since the first cock.
2.1.11	Why, they will allow us ne'er a jordan, and then we leak in your chimney; and your chamber-lie breeds fleas like a loach.
2.1.12	What, ostler I come away and be hanged! come away.
2.1.13	I have a gammon of bacon and two razes of ginger, to be delivered as far as Charing-cross.
2.1.14	God's body! the turkeys in my pannier are quite starved. What, ostler! A plague on thee! hast thou never an eye in thy head? canst not hear? An 'twere not as good deed as drink, to break the pate on thee, I am a very villain. Come, and be hanged! hast no faith in thee? Enter GADSHILL.
2.1.15	Good morrow, carriers. What's o'clock ?
2.1.16	I think it be two o'clock.
2.1.17	I prithee, lend me thy lantern, to see my gelding in the stable.
2.1.18	Nay, by God, soft; I know a trick worth two of that, i' faith.
2.1.19	I pray thee, lend me thine.
2.1.20	Ay, when? canst tell? Lend me thy lantern, quoth he? marry, I'll see thee hanged first.
2.1.21	Sirrah carrier, what time do you mean to come to London?
2.1.22	Time enough to go to bed with a candle, I warrant thee. Come, neighbour Mugs, we'll call up the gentlemen: they will along with company, for they have great charge. [Ex]eunt Carriers.
2.1.23	What, ho! chamberlain!
2.1.24	[Within]
2.1.25	At hand, quoth pickpurse.
2.1.26	That's even as fair as—at hand, quoth the chamberlain; for thou variest no more from picking of purses than giving direction doth from labouring; thou layest the plot how. Enter Chamberlain.
2.1.27	Good morrow, Master Gadshill. It holds current that I told you yesternight: there's a franklin in the wild of Kent hath brought three hundred marks with him in gold: I heard him tell it to one of his company last night at supper; a kind of auditor; one that hath abundance of charge too, God knows what. They are up already, and call for eggs and butter: they will away presently.
2.1.28	Sirrah, if they meet not with Saint Nicholas' clerks, I'll give thee this neck.
2.1.29	No, I'll none of it: I pray thee, keep that for the hangman; for I know thou worshippest Saint Nicholas as truly as a man of falsehood may.
2.1.30	What talkest thou to me of the hangman? if I hang, I'll make a fat pair of gallows; for if I hang, old Sir John hangs with me, and thou knowest he is no starveling. Tut! there are other Trojans that thou dreamest not of, the which for sport sake are content to do the profession some grace; that would, if matters should be looked into, for their own credit sake, make all whole. I am joined with no foot land-rakers, no long-staff sixpenny strikers, none of these mad mustachio purple-hued malt-worms; but with nobility and tranquillity, burgomasters and great oneyers, such as can hold in, such as will strike sooner than speak, and speak sooner than drink, and drink sooner than pray: and yet, 'zounds, I lie; for they pray continually to their saint, the commonwealth; or rather, not pray to her, but prey on her, for they ride up and down on her and make her their boots.
2.1.31	What, the commonwealth their boots? will she hold out water in foul way?
2.1.32	She will, she will; justice hath liquored her. We steal as in a castle, cocksure; we have the receipt of fern-seed, we walk invisible.
2.1.33	Nay, by my faith, I think you are more beholding to the night than to fern-seed for your walking invisible.
2.1.34	Give me thy hand: thou shalt have a share in our purchase, as I am a true man.
2.1.35	Nay rather let me have it, as you are a false thief.
2.1.36	Go to; ‘homo’ is a common name to all men. Bid the ostler bring my gelding out of the stable. Farewell, you muddy knave. [Exeunt.
2.2.1	The highway, near Gadshill.
2.2.2	Enter PRINCE HENRY and POINS.
2.2.3	Come, shelter, shelter: I have removed Falstaff's horse, and he frets like a gummed velvet.
2.2.4	Stand close. Enter Falstaff.
2.2.5	Poins! Poins, and be hanged! Poins!
2.2.6	Peace, ye fat-kidneyed rascal! what a brawling dost thou keep!
2.2.7	Where's Poins, Hal?
2.2.8	He is walked up to the top of the hill: I'll go seek him.
2.2.9	I am accursed to rob in that thief's company: the rascal hath removed my horse, and tied him I know not where. If I travel but four foot by the squier further afoot, I shall break my wind. Well, I doubt not but to die a fair death for all this, if I 'scape hanging for killing that rogue. I have forsworn his company hourly any time this two and twenty years, and yet I am bewitched with the rogue's company. If the rascal have not given me medicines. Poins! Hal! a plague upon you both! Bardolph! Peto! I'll starve ere I'll rob a foot further. An 'twere not as good a deed as drink, to turn true man and to leave these rogues, I am the veriest varlet that ever chewed with a tooth. Eight yards of uneven ground is threescore and ten miles afoot with me; and the stony-hearted villains know it well enough: a plague upon it when thieves cannot be true one to another! [They whistle] Whew! A plague upon you all! Give me my horse, you rogues; give me my horse, and be hanged!
2.2.10	Peace, ye fat-guts! lie down; lay thine ear close to the ground and list if thou canst hear the tread of travellers.
2.2.11	Have you any levers to lift me up again, being down? 'Sblood, I'll not bear mine own flesh so far afoot again for all the coin in thy father's exchequer. What a plague mean ye to colt me thus?
2.2.12	Thou liest; thou art no colted, thou art uncolted.
2.2.13	I prithee, good Prince Hal, help me to my horse, good king's son.
2.2.14	Out, ye rogue! shall I be your ostler?
2.2.15	Go hang theyself in thine own heirapparent garters! If I be ta'en, I'll peach for this. An I have not ballads made on you all and sung to filthy tunes, let a cup of sack be my poison: when a jest is so forward, and afoot too! I hate it. Enter GADSHILL, BARDOLPH and PETO with him.
2.2.16	Stand.
2.2.17	So I do, against my will.
2.2.18	O, 'tis our setter: I know his voice. Bardolph, what news?
2.2.19	Case ye, case ye; on with your vizards: there's money of the king's coming down the hill; 'tis going to the king's exchequer.
2.2.20	You lie, ye rogue; 'tis going to the king's tavern.
2.2.21	There's enough to make us all.
2.2.22	To be hanged.
2.2.23	Sirs, you four shall front them in the narrow lane; Ned Poins and I will walk lower: if they 'scape from your encounter, then they light on us.
2.2.24	How many be there of them?
2.2.25	Some eight or ten.
2.2.26	'Zounds, will they not rob us?
2.2.27	What, a coward, Sir John Paunch?
2.2.28	Indeed, I am not John of Gaunt, your grandfather; but yet no coward, Hal.
2.2.29	Well, we leave that to the proof.
2.2.30	Sirrah Jack, thy horse stands behind the hedge: when thou needest him, there thou shalt find him. Farewell, and stand fast.
2.2.31	Now cannot I strike him, if I should be hanged.
2.2.32	Ned, where are our disguises?
2.2.33	Here, hard by: stand close. [Ex]eunt Prince and Poins.
2.2.34	Now, my masters, happy man be his dole, say I: every man to his business. Enter the Travellers.
2.2.35	Come, neighbour: that boy shall lead our horses down the hill; we'll walk afoot awhile, and ease our legs.
2.2.36	Stand!
2.2.37	Jesus bless us!
2.2.38	Strike; down with them; cut the villains' throats: ah! whoreson caterpillars! bacon-fed knaves! they hate us youth: down with them; fleece them.
2.2.39	O, we are undone, both we and ours forever!
2.2.40	Hang ye, gorbellied knaves, are ye undone? No, ye fat chuffs; I would your store were here! On, bacons, on! What, ye knaves! young men must live. You are grand-jurors, are ye? we'll jure ye, 'faith. [Here they rob them and bind them. Exeunt. Re-enter PRINCE HENRY and POINS.
2.2.41	The thieves have bound the true men. Now could thou and I rob the thieves and go merrily to London, it would be argument for a week, laughter for a month and a good jest for ever.
2.2.42	Stand close; I hear them coming. Enter the Thieves again.
2.2.43	Come, my masters, let us share, and then to horse before day. An the Prince and Poins be not two arrant cowards, there's no equity stirring: there's no more valour in that Poins than in a wild-duck.
2.2.44	Your money!
2.2.45	Villains! [As they are sharing, the Prince and Poins set upon them; they all run away; and Falstaff, after a blow or two, runs away too, leaving the booty behind them.]
2.2.46	Got with much ease. Now merrily to horse: The thieves are all scatter'd and possess'd with fear So strongly that they dare not meet each other; Each takes his fellow for an officer. Away, good Ned. Falstaff sweats to death, And lards the lean earth as he walks along: Weren't not for laughing, I should pity him.
2.2.47	How the rogue roar'd! [Exeunt.
2.3.1	Warkworth castle.
2.3.2	Enter HOTSPUR, solus, reading a letter.
2.3.3	But, for mine own part, my lord, I could be well contented to be there, in respect of the love I bear your house. He could be contented: why is he not, then? In respect of the love he bears our house: he shows in this, he loves his own barn better than he loves our house. Let me see some more. The purpose you undertake is dangerous;— why, that's certain: 'tis dangerous to take a cold, to sleep, to drink; but I tell you, my lord fool, out of this nettle, danger, we pluck this flower, safety. The purpose you undertake is dangerous; the friends you have named uncertain; the time itself unsorted; and your whole plot too light for the counterpoise of so great an opposition. Say you so, say you so? I say unto you again, you are a shallow cowardly hind, and you lie. What a lackbrain is this! By the Lord, our plot is a good plot as ever was laid; our friends true and constant: a good plot, good friends, and full of expectation; an excellent plot, very good friends. What a frosty-spirited rogue is this! Why, my lord of York commends the plot and the general course of the action. 'Zounds, an I were now by this rascal, I could brain him with his lady's fan. Is there not my father, my uncle and myself? lord Edmund Mortimer, my lord of York and Owen Glendower? is there not besides the Douglas? have I not all their letters to meet me in arms by the ninth of the next month? and are they not some of them set forward already? What a pagan rascal is this! an infidel! Ha! you shall see now in very sincerity of fear and cold heart, will he to the king and lay open all our proceedings. O, I could divide myself and go to buffets, for moving such a dish of skim milk with so honourable an action! Hang him! let him tell the king: we are prepared. I will set forward to-night. Enter LADY PERCY. How now, Kate! I must leave you within these two hours.
2.3.4	O, my good lord, why are you thus alone? For what offence have I this fortnight been A banish'd woman from my Harry's bed? Tell me, sweet lord, what is't that takes from thee Thy stomach, pleasure and thy golden sleep? Why dost thou bend thine eyes upon the earth, And start so often when thou sit'st alone? Why hast thou lost the fresh blood in thy cheeks; And given my treasures and my rights of thee To thick-eyed musing and cursed melancholy? In thy faint slumbers I by thee have watch'd, And heard thee murmur tales of iron wars; Speak terms of manage to thy bounding steed; Cry 'Courage! to the field!' And thou hast talk'd Of sallies and retires, of trenches, tents, Of palisadoes, frontiers, parapets, Of basilisks, of cannon, culverin, Of prisoners' ransom and of soldiers slain, And all the currents of a heady fight. The spirit within thee hath been so at war And thus hast so bestirr'd thee in thy sleep, That beads of sweat have stood upon thy brow, Like bubbles in a late-disturbed stream; And in thy face strong motions have appear'd, Such as we see when men restrain their breath On some great sudden hest. O, what portents are these? Some heavy business hath my lord in hand, And I must know it, else he loves me not.
2.3.5	What, ho! Enter Servant. Is Gilliams with the packet gone?
2.3.6	He is, my lord, an hour ago.
2.3.7	Hath Butler brought those horses from the sheriff?
2.3.8	One horse, my lord, he brought even now.
2.3.9	What horse? a roan, a crop-ear, is it not?
2.3.10	It is, my lord.
2.3.11	That roan shall be my throne. Well, I will back him straight: O esperance! Bid Butler lead him forth into the park. [Ex]it Servant.
2.3.12	But hear you, my lord.
2.3.13	What say'st thou, my lady?
2.3.14	What is it carries you away?
2.3.15	Why, my horse, my love, my horse.
2.3.16	Out, you mad-headed ape. A weasel hath not such a deal of spleen As you are toss'd with. In faith, I'll know your business, Harry, that I will. I fear my brother Mortimer doth stir About his title, and hath sent for you To line his enterprize: but if you go,—
2.3.17	So far afoot, I shall be weary, love.
2.3.18	Come, come, you paraquito, answer me Directly unto this question that I ask: In faith, I'll break thy little finger, Harry, An if thou wilt not tell me all things true.
2.3.19	Away, Away, you trifler! Love! I love thee not, I care not for thee, Kate: this is no world To play with mammets and to tilt with lips: We must have bloody noses and crack'd crowns, And pass them current too. God's me, my horse! What say'st thou, Kate? what would'st thou have with me?
2.3.20	Do you not love me? do you not, indeed? Well, do not then; for since you love me not, I will not love myself. Do you not love me? Nay, tell me if you speak in jest or no.
2.3.21	Come, wilt thou see me ride? And when I am o' horseback, I will swear I love thee infinitely. But hark you, Kate; I must not have you henceforth question me Whither I go, nor reason whereabout: Whither I must, I must; and, to conclude, This evening must I leave you, gentle Kate. I know you wise, but yet no farther wise Than Harry Percy's wife: constant you are, But yet a woman: and for secrecy, No lady closer; for I well believe Thou wilt not utter what thou dost not know; And so far will I trust thee, gentle Kate.
2.3.22	How! so far?
2.3.23	Not an inch further. But hark you, Kate: Whither I go, thither shall you go too; To-day will I set forth, to-morrow you. Will this content you, Kate?
2.3.24	It must of force.
2.3.25	[Exeunt.
2.4.1	The Boar's-Head Tavern, Eastcheap.
2.4.2	Enter the PRINCE, and POINS.
2.4.3	Ned, prithee, come out of that fat room, and lend me thy hand to laugh a little.
2.4.4	Where hast been, Hal?
2.4.5	With three or four loggerheads amongst three or four score hogsheads. I have sounded the very base-string of humility. Sirrah, I am sworn brother to a leash of drawers; and can call them all by their christen names, as Tom, Dick, and Francis. They take it already upon their salvation, that though I be but Prince of Wales, yet I am the king of courtesy; and tell me flatly I am no proud Jack, like Falstaff, but a Corinthian, a lad of mettle, a good boy, by the Lord, so they call me, and when I am king of England, I shall command all the good lads in Eastcheap. They call drinking deep, dyeing scarlet; and when you breathe in your watering, they cry 'hem!' and bid you play it off. To conclude, I am so good a proficient in one quarter of an hour, that I can drink with any tinker in his own language during my life. I tell thee, Ned, thou hast lost much honour, that thou wert not with me in this action. But, sweet Ned,—to sweeten which name of Ned, I give thee this pennyworth of sugar, clapped even now into my hand by an under-skinker, one that never spake other English in his life than 'Eight shillings and sixpence,' and 'You are welcome,' with this shrill addition, 'Anon, anon, sir! Score a pint of bastard in the Half-moon,' or so. But, Ned, to drive away the time till Falstaff come, I prithee, do thou stand in some by-room, while I question my puny drawer to what end he gave me the sugar; and do thou never leave calling 'Francis,' that his tale to me may be nothing but 'Anon.' Step aside, and I'll show thee a precedent.
2.4.6	Francis!
2.4.7	Thou art perfect.
2.4.8	Francis! [Exit Poins. Enter FRANCIS.
2.4.9	Anon, anon, sir. Look down into the Pomgarnet, Ralph.
2.4.10	Come hither, Francis.
2.4.11	My lord?
2.4.12	How long hast thou to serve, Francis ?
2.4.13	Forsooth, five years, and as much as to—
2.4.14	[Within] Francis!
2.4.15	Anon, anon, sir.
2.4.16	Five year! by'r lady, a long lease for the clinking of pewter. But, Francis, darest thou be so valiant as to play the coward with thy indenture and show it a fair pair of heels and run from it?
2.4.17	O Lord, sir, I'll be sworn upon all the books in England, I could find it in my heart.
2.4.18	[Within]
2.4.19	Francis!
2.4.20	Anon, sir.
2.4.21	How old art thou, Francis?
2.4.22	Let me see—about Michaelmas next I shall be—
2.4.23	[Within]
2.4.24	Francis!
2.4.25	Anon, sir. Pray stay a little, my lord.
2.4.26	Nay, but hark you, Francis: for the sugar thou gavest me, 'twas a pennyworth, was't not?
2.4.27	O Lord, I would it had been two!
2.4.28	I will give thee for it a thousand pound: ask me when thou wilt, and thou shalt have it.
2.4.29	[Within] Francis!
2.4.30	Anon, anon.
2.4.31	Anon, Francis? No, Francis; but to-morrow, Francis; or Francis, o' Thursday; or indeed, Francis, when thou wilt. But, Francis!
2.4.32	My lord?
2.4.33	Wilt thou rob this leathern jerkin, crystal-button, not-pated, agate-ring, puke-stocking, stocking, caddis-garter, smooth-tongue, Spanish-pouch—
2.4.34	O Lord, sir, what do you mean?
2.4.35	Why, then, your brown bastard is your only drink; for look you, Francis, your white canvas doublet will sully: in Barbary, sir, it cannot come to so much.
2.4.36	What, sir?
2.4.37	[Within]
2.4.38	Francis!
2.4.39	Away, you rogue! dost thou not hear them call? [Here they both call him; the drawer stands amazed, not knowing which way to go. Enter Vintner.
2.4.40	What, standest thou still, and hearest such a calling? Look to the guests within. [Ex]it Francis.] My lord, old Sir John, with half-a-dozen more, are at the door: shall I let them in?
2.4.41	Let them alone awhile, and then open the door. [Ex]it Vintner.] Poins! Re-enter POINS.
2.4.42	Anon, anon, sir.
2.4.43	Sirrah, Falstaff and the rest of the thieves are at the door: shall we be merry?
2.4.44	As merry as crickets, my lad. But hark ye; what cunning match have you made with this jest of the drawer? come, what's the issue?
2.4.45	I am now of all humours that have showed themselves humours since the old days of goodman Adam to the pupil age of this present twelve o'clock at midnight. Re-enter FRANCIS. What's o'clock, Francis?
2.4.46	Anon, anon, sir. [Exit.
2.4.47	That ever this fellow should have fewer words than a parrot, and yet the son of a woman! His industry is up-stairs and down-stairs; his eloquence the parcel of reckoning. I am not yet of Percy's mind, the Hotspur of the north; he that kills me some six or seven dozen of Scots at a breakfast, washes his hands, and says to his wife 'Fie upon this quiet life! I want work.' 'O my sweet Harry,' says she, 'how many hast thou killed to-day?' 'Give my roan horse a drench,' says he; and answers 'Some fourteen,' an hour after; 'a trifle, a trifle.' I prithee, call in Falstaff: I'll play Percy, and that damned brawn shall play Dame Mortimer his wife. 'Rivo!' says the drunkard. Call in ribs, call in tallow. Enter FALSTAFF, GADSHILL, BARDOLPH, and PETO; FRANCIS following with wine.
2.4.48	Welcome, Jack: where hast thou been?
2.4.49	A plague of all cowards, I say, and a vengeance too! marry, and amen! Give me a cup of sack, boy. Ere I lead this life long, I'll sew nether stocks and mend them and foot them too. A plague of all cowards! Give me a cup of sack, rogue. Is there no virtue extant? [He drinks.
2.4.50	Didst thou never see Titan kiss a dish of butter? pitiful-hearted Titan, that melted at the sweet tale of the sun's! if thou didst, then behold that compound.
2.4.51	You rogue, here's lime in this sack too: there is nothing but roguery to be found in villanous man: yet a coward is worse than a cup of sack with lime in it. A villanous coward! Go thy ways, old Jack; die when thou wilt, if manhood, good manhood, be not forgot upon the face of the earth, then am I a shotten herring. There live not three good men unhanged in England; and one of them is fat and grows old: God help the while! a bad world, I say. I would I were a weaver; I could sing psalms or any thing. A plague of all cowards, I say still.
2.4.52	How now, wool-sack! what mutter you?
2.4.53	A king's son. If I do not beat thee out of thy kingdom with a dagger of lath, and drive all thy subjects afore thee like a flock of wild-geese, I'll never wear hair on my face more. You Prince of Wales!
2.4.54	Why, you whoreson round man, what's the matter?
2.4.55	Are not you a coward? answer me to that: and Poins there?
2.4.56	'Zounds, ye fat paunch, an ye call me coward, by the Lord, I'll stab thee.
2.4.57	I call thee coward! I'll see thee damned ere I call thee coward: but I would give a thousand pound I could run as fast as thou canst. You are straight enough in the shoulders, you care not who sees your back: call you that backing of your friends? A plague upon such backing! give me them that will face me. Give me a cup of sack: I am a rogue, if I drunk to-day.
2.4.58	O villain! thy lips are scarce wiped since thou drunkest last.
2.4.59	All's one for that. [He drinks.] A plague of all cowards, still say I.
2.4.60	What's the matter?
2.4.61	What's the matter! there be four of us here have ta'en a thousand pound this day morning.
2.4.62	Where is it, Jack? where is it?
2.4.63	Where is it! taken from us it is: a hundred upon poor four of us.
2.4.64	What, a hundred, man?
2.4.65	I am a rogue, if I were not at half- sword with a dozen of them two hours together. I have 'scaped by miracle. I am eight times thrust through the doublet, four through the hose; my buckler cut through and through; my sword hacked like a hand-saw—ecce signum! I never dealt better since I was a man: all would not do. A plague of all cowards! Let them speak: if they speak more or less than truth, they are villains and the sons of darkness.
2.4.66	Speak, sirs; how was it?
2.4.67	We four set upon some dozen—
2.4.68	Sixteen at least, my lord.
2.4.69	And bound them.
2.4.70	No, no, they were not bound.
2.4.71	You rogue, they were bound, every man of them; or I am a Jew else, an Ebrew Jew.
2.4.72	As we were sharing, some six or seven fresh men set upon us—
2.4.73	And unbound the rest, and then come in the other.
2.4.74	What, fought you with them all?
2.4.75	All! I know not what you call all; but if I fought not with fify of them, I am a bunch of radish: if there were not two or three and fifty upon poor old Jack, then am I no two-legged creature.
2.4.76	Pray God you have not murdered some of them.
2.4.77	Nay, that's past praying for: I have peppered two of them; two I am sure I have paid, two rogues in buckram suits. I tell thee what, Hal, if I tell thee a lie, spit in my face, call me horse. Thou knowest my old ward; here I lay, and thus I bore my point. Four rogues in buckram let drive at me—
2.4.78	What, four? thou saidst but two even now.
2.4.79	Four, Hal; I told thee four.
2.4.80	Ay, ay, he said four.
2.4.81	These four came all a-front, and mainly thrust at me. I made me no more ado but took all their seven points in my target, thus.
2.4.82	Seven? why, there were but four even now.
2.4.83	In buckram?
2.4.84	Ay, four, in buckram suits.
2.4.85	Seven, by these hilts, or I am a villain else.
2.4.86	Prithee, let him alone; we shall have more anon.
2.4.87	Dost thou hear me, Hal?
2.4.88	Ay, and mark thee too, Jack.
2.4.89	Do so, for it is worth the listening to. These nine in buckram that I told thee of—
2.4.90	So, two more already.
2.4.91	Their points being broken,—
2.4.92	Down fell their hose.
