1.0.0	ACT I
2.4.93	Began to give me ground: but I followed me close, came in foot and hand; and with a thought seven of the eleven I paid.
2.4.94	O monstrously eleven buckram men grown out of two!
2.4.95	But, as the devil would have it, three misbegotten knaves in Kendal green came at my back and let drive at me; for it was so dark, Hal, that thou couldst not see thy hand.
2.4.96	These lies are like their father that begets them; gross as a mountain, open, palpable. Why, thou clay-brained guts, thou knotty-pated fool, thou whoreson, obscene, greasy tallow-catch,—
2.4.97	What, art thou mad? art thou mad? is not the truth the truth?
2.4.98	Why, how couldst thou know these mnen in Kendal green, when it was so dark thou couldst not see thy hand? come, tell us your reason: what sayest thou to this?
2.4.99	Come, your reason, Jack, your reason.
2.4.100	What, upon compulsion? 'Zounds, an I were at the strappado, or all the racks in the world, I would not tell you on compulsion. Give you a reason on compulsion if reasons were as plentiful as blackberries, I would give no man a reason upon compulsion, I.
2.4.101	I 'll be no longer guilty of this sin; this sanguine coward, this bed-presser, this horseback-breaker, this huge hill of flesh,—
2.4.102	'Sblood, you starveling, you elf-skin, you dried neat's tongue, you bull's pizzle, you stock-fish! O for breath to utter what is like thee! you tailor's-yard, you sheath, you bowcase, you vile standing-tuck,—
2.4.103	Well, breathe awhile, and then to it again: and when thou hast tired thyself in base comparisons, hear me speak but this.
2.4.104	Mark, Jack.
2.4.105	We two saw you four set on four and bound them, and were masters of their wealth. Mark now, how a plain tale shall put you down. Then did we two set on you four; and, with a word, out-faced you from your prize, and have it; yea, and can show it you here in the house: and, Falstaff, you carried your guts away as nimbly, with as quick dexterity, and roared for mercy and still run and roared, as ever I heard bull-calf. What a slave art thou, to hack thy sword as thou hast done, and then say it was in fight! What trick, what device, what starting-hole, canst thou now find out to hide thee from this open and apparent shame?
2.4.106	Come, let's hear, Jack; what trick hast thou now?
2.4.107	By the Lord, I knew ye as well as he that made ye. Why, hear you, my masters: was it for me to kill the heir-apparent? should I turn upon the true prince? why, thou knowest I am as valiant as Hercules: but beware instinct; the lion will not touch the true prince. Instinct is a great matter; I was now a coward on instinct. I shall think the better of myself and thee during my life; I for a valiant lion, and thou for a true prince But, by the Lord, lads, I am glad you have the money. Hostess, clap to the doors: watch to-night, pray to-morrow. Gallants, lads, boys, hearts of gold, all the titles Qf good fellowship come to you I What, shall we be merry? shall we have a play extempore?
2.4.108	Content; and the argument shall be thy running away.
2.4.109	Ah, no more of that, Hal, an thou lovest me! Enter Hostess.
2.4.110	O Jesu, my lord the prince!
2.4.111	How now, my lady the hostess what sayest thou to me?
2.4.112	Marry, my lord, there is a nobleman of the court at door would speak with you: he says he comes from your father.
2.4.113	Give him as much as will make him a royal man, and send him back again to my mother.
2.4.114	What manner of man is he?
2.4.115	An old man.
2.4.116	What doth gravity out of his bed at midnight? Shall I give him his answer?
2.4.117	Prithee, do, Jack.
2.4.118	'Faith, and I'll send him packing. [Ex]it.
2.4.119	Now, sirs: by'r lady, you fought fair; so did you, Peto; so did you, Bardolph: you are lions too, you ran away upon instinct, you will not touch the true prince; no, fie!
2.4.120	'Faith, I ran when I saw others run.
2.4.121	'Faith, tell me now in earnest, how came Falstaff's sword so hacked?
2.4.122	Why, he hacked it with his dagger, and said he would swear truth out of England but he would make you believe it was done in fight, and persuaded us to do the like.
2.4.123	Yea, and to tickle our noses with spear-grass to make them bleed, and then to beslubber our garments with it and swear it was the blood of true men. I did that I did not this seven year before, I blushed to hear his monstrous devices.
2.4.124	O villain, thou stolest a cup of sack eighteen years ago, and wert taken with the manner, and ever since thou hast blushed extempore. Thou hadst fire and sword on thy side, and yet thou rannest away: what instinct hadst thou for it?
2.4.125	My lord, do you see these meteors? do you behold these exhalations?
2.4.126	I do.
2.4.127	What think you they portend?
2.4.128	Hot livers and cold purses.
2.4.129	Choler, my lord, if rightly taken.
2.4.130	No, if rightly taken, halter. Re-enter FALSTAFF. Here comes lean Jack, here comes bare-bone. How now, my sweet creature of bombast! How long is't ago, Jack, since thou sawest thine own knee?
2.4.131	My own knee! when I was about thy years, Hal, I was not an eagle's talon in the waist; I could have crept into any alderman's thumb-ring: a plague of sighing and grief! it blows a man up like a bladder. There's villanous news abroad: here was Sir John Bracy from your father; you must to the court in the morning. That same mad fellow of the north, Percy, and he of Wales, that gave Amamon the bastinado and made Lucifer cuckold and swore the devil his true liegeman upon the cross of a Welsh hook—what a plague call you him?
2.4.132	O, Glendower.
2.4.133	Owen, Owen, the same; and his son-in-law Mortimer; and old Northumberland, and that sprightly Scot of Scots, Douglas, that runs o' horseback up a hill perpendicular,—
2.4.134	He that rides at high speed and with his pistol kills a sparrow flying.
2.4.135	You have hit it.
2.4.136	So did he never the sparrow.
2.4.137	Well, that rascal hath good mettle in him; he will not run.
2.4.138	Why, what a rascal art thou then, to praise him so for running!
2.4.139	O' horseback, ye cuckoo; but afoot he will not budge a foot.
2.4.140	Yes, Jack, upon instinct.
2.4.141	I grant ye, upon instinct. Well, he is there too, and one Mordake, and a thousand blue-caps more: Worcester is stolen away tonight; thy father's beard is turned white with the news: you may buy land now as cheap as stinking mackerel.
2.4.142	Why, then, it is like, if there come a hot June and this civil buffeting hold, we shall buy' maidenheads as they buy hob-nails, by the hundreds.
2.4.143	By the mass, lad, thou sayest true; it is like we shall have good trading that way. But tell me, Hal, art not thou horrible afeard? thou being heir-apparent, could the world pick thee out three such enemies again as that fiend Douglas, that spirit Percy, and that devil Glendower? Art thou not horribly afraid? doth not thy blood thrill at it?
2.4.144	Not a whit, i' faith; I lack some of thy instinct.
2.4.145	Well, thou wilt be horribly chid tomorrow when thou comest to thy father: if thou love me, practise an answer.
2.4.146	Do thou stand for my father, and examine me upon the particulars of my life.
2.4.147	Shall I? content: this chair shall be my state, this dagger my sceptre, and this cushion my crown.
2.4.148	Thy state is taken for a joined-stool, thy golden sceptre for a leaden dagger, and thy precious rich crown for a pitiful bald crown!
2.4.149	Well, an the fire of grace be not quite out of thee, now shalt thou be moved. Give me a cup of sack to make my eyes look red, that it may be thought I have wept; for I must speak in passion, and I will do it in King Cambyses' vein.
2.4.150	Well, here is my leg.
2.4.151	And here is my speech. Stand aside, nobility.
2.4.152	O Jesu, this is excellent sport, i' faith!
2.4.153	Weep not, sweet queen; for trickling tears are vain.
2.4.154	O, the father, how he holds his countenance!
2.4.155	For God's sake, lords, convey my tristful queen; For tears do stop the flood-gates of her eyes.
2.4.156	O Jesu, he doth it as like one of these harlotry players as ever I see!
2.4.157	Peace, good pint-pot; peace, good tickle-brain. Harry, I do not only marvel where thou spendest thy time, but also how thou art accompanied: for though the camomile, the more it is trodden on the faster it grows, yet youth, the more it is wasted the sooner it wears. That thou art my son, I have partly thy mother's word, partly my own opinion, but chiefly a villanous trick of thine eye and a foolish hanging of thy nether lip, that doth warrant me. If then thou be son to me, here lies the point; why, being son to me, art thou so pointed at? Shall the blessed sun of heaven prove a micher and eat blackberries? a question not to be asked. Shall the son of England prove a thief and take purses? a question to be asked. There is a thing, Harry, which thou hast often heard of and it is known to many in our land by the name of pitch: this pitch, as ancient writers do report, doth defile; so doth the company thou keepest: for, Harry, now I do not speak to thee in drink but in tears, not in pleasure but in passion, not in words only, but in woes also: and yet there is a virtuous man whom I have often noted in thy company, but I know not his name.
2.4.158	What manner of man, an it like your majesty?
2.4.159	A goodly portly man, i' faith, and a corpulent; of a cheerful look, a pleasing eye and a most noble carriage; and, as I think, his age some fifty, or, by 'r lady, inclining to three score; and now I remember me, his name is Falstaff: if that man should be lewdly given, he deceiveth me; for, Harry, I see virtue in his looks. If then the tree may be known by the fruit, as the fruit by the tree, then, peremptorily I speak it, there is virtue in that Falstaff: him keep with, the rest banish. And tell me now, thou naughty varlet, tell me, where hast thou been this month?
2.4.160	Dost thou speak like a king? Do thou stand for me, and I'll play my father.
2.4.161	Depose me? if thou dost it half so gravely, so majestically, both in word and matter, hang me up by the heels for a rabbitsucker or a poulter's hare.
2.4.162	Well, here I am set.
2.4.163	And here I stand: judge, my masters.
2.4.164	Now, Harry, whence come you?
2.4.165	My noble lord, from Eastcheap.
2.4.166	The complaints I hear of thee are grievous.
2.4.167	'Sblood, my lord, they are false: nay, I'll tickle ye for a young prince, i' faith.
2.4.168	Swearest thou, ungracious boy? henceforth ne'er look on me. Thou art violently carried away from grace: there is a devil haunts thee in the likeness of an old fat man; a tun of man is thy companion. Why dost thou converse with that trunk of humours, that bolting-hutch of beastliness, that swollen parcel of dropsies, that huge bombard of sack, that stuffed cloak-bag of guts, that roasted Manning-tree ox with the pudding in his belly, that reverend vice, that grey iniquity, that father ruffian, that vanity in years? Wherein is he good, but to taste sack and drink it? wherein neat and cleanly, but to carve a capon and eat it? wherein cunning, but in craft? wherein crafty, but in villany? wherein villanous, but in all things? wherein worthy, but in nothing?
2.4.169	I would your grace would take me with you: whom means your grace?
2.4.170	That villanous abominable misleader of youth, Falstaff, that old whitebearded Satan.
2.4.171	My lord, the man I know.
2.4.172	I know thou dost.
2.4.173	But to say I know more harm in him than in myself, were to say more than I know. That he is old, the more the pity, his white hairs do witness it; but that he is, saving your reverence, a whoremaster, that I utterly deny. If sack and sugar be a fault, God help the wicked! if to be old and merry be a sin, then many an old host that I know is damned: if to be fat be to be hated, then Pharaoh's lean kine are to be loved. No, my good lord; banish Peto, banish Bardolph, banish Poins: but for sweet Jack Falstaff, kind Jack Falstaff, true Jack Falstaff, valiant Jack Falstaff, and therefore more valiant, being, as he is, old Jack Falstaff, banish not him thy Harry's company, banish not him thy Harry's company: banish plump Jack, and banish all the world.
2.4.174	I do, I will. [A knocking heard. [Exeunt Hostess, Francis, and Bardolph. Re-enter BARDOLPH, running.
2.4.175	O, my lord, my lord! the sheriff with a most monstrous watch is at the door.
2.4.176	Out, ye rogue! Play out the play: I have much to say in the behalf of that Falstaff. Re-enter the Hostess.
2.4.177	O Jesu, my lord, my lord!
2.4.178	Heigh, heigh! the devil rides upon a fiddlestick: what's the matter?
2.4.179	The sheriff and all the watch are at the door: they are come to search the house. Shall I let them in?
2.4.180	Dost thou hear, Hal? never call a true piece of gold a counterfeit: thou art essentially mad, without seeming so.
2.4.181	And thou a natural coward, without instinct.
2.4.182	I deny your major: if you will deny the sheriff, so; if not, let him enter: if I become not a cart as well as another man, a plague on my bringing up! I hope I shall as soon be strangled with a halter as another.
2.4.183	Go, hide thee behind the arras: the rest walk up above. Now, my masters, for a true face and good conscience.
2.4.184	Both which I have had: but their date is out, and therefore I'll hide me.
2.4.185	Call in the sheriff. [Ex]eunt all except the Prince and Peto. Enter Sheriff and the Carrier.
2.4.186	Now, master sheriff, what is your will with me?
2.4.187	First, pardon me, my lord. A hue and cry Hath follow'd certain men unto this house.
2.4.188	What men?
2.4.189	One of them is well known, my gracious lord, A gross fat man.
2.4.190	As fat as butter.
2.4.191	The man, I do assure you, is not here; For I myself at this time have employ'd him. And, sheriff, I will engage my word to thee That I will, by to-morrow dinner-time, Send him to answer thee, or any man, For any thing he shall be charged withal: And so let me entreat you leave the house.
2.4.192	I will, my lord. There are two gentlemen Have in this robbery lost three hundred marks.
2.4.193	It may be so: if he have robb'd these men, He shall be answerable; and so farewell.
2.4.194	Good night, my noble lord.
2.4.195	I think it is good morrow, is it not?
2.4.196	Indeed, my lord, I think it be two o'clock. [Ex]eunt Sheriff and Carrier.
2.4.197	This oily rascal is known as well as Paul's. Go, call him forth.
2.4.198	Falstaff!—Fast asleep behind the arras, and snorting like a horse.
2.4.199	Hark, how hard he fetches breath. Search his pockets. [He searcheth his pockets and findeth certain papers.] What hast thou found?
2.4.200	Nothing but papers, my lord.
2.4.201	Let's see what they be: read them.
2.4.202	[Reads]
2.4.203	Item, A capon, . . . 2s. 2d. Item, Sauce, . 4d. Item, Sack, two gallons, 5s. 8d. Item, Anchovies and sack after supper, . . . 2s. 6d. Item, Bread . . ob.
2.4.204	O monstrous! but one half-penny- worth of bread to this intolerable deal of sack! What there is else, keep close; we'll read it at more advantage: there let him sleep till day. I'll to the court in the morning. We must all to the wars, and thy place shall be honourable. I'll procure this fat rogue a charge of foot; and I know his death will be a march of twelve-score. The money shall be paid back again with advantage. Be with me betimes in the morning; and so, good morrow, Peto.
2.4.205	Good morrow, good my lord. [Ex]eunt.
3.0.0	ACT III
3.1.1	Bangor. The Archdeacon's house.
3.1.2	Enter HOTSPUR, WORCESTER, MORTIMER, and GLENDOWER.
3.1.3	These promises are fair, the parties sure, And our induction full of prosperous hope.
3.1.4	Lord Mortimer, and cousin Glendower, Will you sit down? And uncle Worcester: a plague upon it! I have forgot the map.
3.1.5	No, here it is. Sit, cousin Percy; sit, good cousin Hotspur, For by that name as oft as Lancaster Doth speak of you, his cheek looks pale and with A rising sigh he wisheth you in heaven.
3.1.6	And you in hell, as oft as he hears Owen Glendower spoke of.
3.1.7	I cannot blame him: at my nativity The front of heaven was full of fiery shapes, Of burning cressets; and at my birth The frame and huge foundation of the earth Shaked like a coward.
3.1.8	Why, so it would have done at the same season, if your mother's cat had but kittened, though yourself had never been born.
3.1.9	I say the earth did shake when I was born.
3.1.10	And I say the earth was not of my mind, If you suppose as fearing you it shook.
3.1.11	The heavens were all on fire, the earth did tremble.
3.1.12	O, then the earth shook to see the heavens on fire, And not in fear of your nativity. Diseased nature oftentimes breaks forth In strange eruptions; oft the teeming earth Is with a kind of colic pinch'd and vex'd By the imprisoning of unruly wind Within her womb; which, for enlargement striving, Shakes the old beldam earth and topples down Steeples and moss-grown towers. At your birth Our grandam earth, having this distemperature, In passion shook.
3.1.13	Cousin, of many men I do not bear these crossings. Give me leave To tell you once again that at my birth The front of heaven was full of fiery shapes, The goats ran from the mountains, and the herds Were strangely clamorous to the frighted fields. These signs have mark'd me extraordinary; And all the courses of my life do show I am not in the roll of common men. Where is he living, clipp'd in with the sea That chides the banks of England, Scotland, Wales, Which calls me pupil, or hath read to me? And bring him out that is but woman's son Can trace me in the tedious ways of art And hold me pace in deep experiments.
3.1.14	I think there's no man speaks better Welsh. I'll to dinner.
3.1.15	Peace, cousin Percy; you will make him mad.
3.1.16	I can call spirits from the vasty deep.
3.1.17	Why, so can I, or so can any man; But will they come when you do call for them?
3.1.18	Why, I can teach you, cousin, to command The devil.
3.1.19	And I can teach thee, coz, to shame the devil By telling truth: tell truth and shame the devil. If thou have power to raise him, bring him hither, And I'll be sworn I have power to shame him hence. O, while you live, tell truth and shame the devil!
3.1.20	Come, come, no more of this unprofitable chat.
3.1.21	Three times hath Henry Bolingbroke made head Against my power; thrice from the banks of Wye And sandy-bottom'd Severn have I sent him Bootless home and weather-beaten back.
3.1.22	Home without boots, and in foul weather too! How 'scapes he agues, in the devil's name?
3.1.23	Come, here's the map: shall we divide our right According to our threefold order ta'en?
3.1.24	The archdeacon hath divided it Into three limits very equally: England, from Trent and Severn hitherto, By south and east is to my part assign'd: All westward, Wales beyond the Severn shore, And all the fertile land within that bound, To Owen Glendower: and, dear coz, to you The remnant northward, lying off from Trent. And our indentures tripartite are drawn; Which being sealed interchangeably, A business that this night may execute, To-morrow, cousin Percy, you and I And my good Lord of Worcester will set forth To meet your father and the Scottish power, As is appointed us, at Shrewsbury. My father Glendower is not ready yet, Nor shall we need his help these fourteen days. Within that space you may have drawn together Your tenants, friends and neighbouring gentlemen.
3.1.25	A shorter time shall send me to you, lords: And in my conduct shall your ladies come; From whom you now must steal and take no leave, For there will be a world of water shed Upon the parting of your wives and you.
3.1.26	Methinks my moiety, north from Burton here, In quantity equals not one of yours: See how this river comes me cranking in, And cuts me from the best of all my land A huge half-moon, a monstrous cantle out. I'll have the current in this place damned up; And here the smug and silver Trent shall run In a new channel, fair and evenly; It shall not wind with such a deep indent, To rob me of so rich a bottom here.
3.1.27	Not wind? it shall, it must; you see it doth.
3.1.28	Yea, but Mark how he bears his course, and runs me up With like advantage on the other side; Gelding the opposed continent as much As on the other side it takes from you.
3.1.29	Yea, but a little charge will trench him here And on this north side win this cape of land; And then he runs straight and even.
3.1.30	I'll have it so: a little charge will do it.
3.1.31	I'll not have it alter'd.
3.1.32	Will not you?
3.1.33	No, nor you shall not.
3.1.34	Who shall say me nay?
3.1.35	Why, that will I.
3.1.36	Let me not understand you, then; speak it in Welsh.
3.1.37	I can speak English, lord, as well as you; For I was train'd up in the English court; Where, being but young, I framed to the harp Many an English ditty lovely well And gave the tongue a helpful ornament, A virtue that was never seen in you.
3.1.38	Marry, And I am glad of it with all my heart: I had rather be a kitten and cry mew Than one of these same metre ballad-mongers; I had rather hear a brazen canstick turn'd, Or a dry wheel grate on the axle-tree; And that would set my teeth nothing on edge, Nothing so much as mincing poetry: 'Tis like the forced gait of a shuffling nag.
3.1.39	Come, you shall have Trent turn'd.
3.1.40	I do not care: I'll give thrice so much land To any well-deserving friend; But in the way of bargain, mark ye me, I'll cavil on the ninth part of a hair. Are the indentures drawn? shall we be gone?
3.1.41	The moon shines fair; you may away by night: I'll haste the writer and withal Break with your wives of your departure hence: I am afraid my daughter will run mad, So much she doteth on her Mortimer. [Ex]it.
3.1.42	Fie, cousin Percy! how you cross my father!
3.1.43	I cannot choose: sometime he angers me With telling me of the moldwarp and the ant, Of the dreamer Merlin and his prophecies, And of a dragon and a finless fish, A clip-wing'd griffin and a moulten raven, A couching lion and a ramping cat, And such a deal of skimble-skamble stuff As puts me from my faith. I tell you what; He held me last night at least nine hours In reckoning up the several devils' names That were his lackeys: I cried 'hum,' and 'well, go to,' But mark'd him not a word. O, he is as tedious As a tired horse, a railing wife; Worse than a smoky house: I had rather live With cheese and garlic in a windmill, far, Than feed on cates and have him talk to me In any summer-house in Christendom.
3.1.44	In faith, he is a worthy gentleman, Exceedingly well read, and profited In strange concealments, valiant as a lion And wondrous affable and as bountiful As mines of India. Shall I tell you, cousin? He holds your temper in a high respect And curbs himself even of his natural scope When you come 'cross his humour; faith, he does: I warrant you, that man is not alive Might so have tempted him as you have done, Without the taste of danger and reproof: But do not use it oft, let me entreat you.
3.1.45	In faith, my lord, you are too wilful-blame; And since your coming hither have done enough To put him quite beside his patience. You must needs learn, lord, to amend this fault: Though sometimes it show greatness, courage, blood,— And that's the dearest grace it renders you,— Yet oftentimes it doth present harsh rage, Defect of manners, want of government, Pride, haughtiness, opinion and disdain: The least of which haunting a nobleman Loseth men's hearts and leaves behind a stain Upon the beauty of all parts besides, Beguiling them of commendation.
3.1.46	Well, I am school'd: good manners be your speed! Here come our wives, and let us take our leave. Re-enter GLENDOWER with the ladies.
3.1.47	This is the deadly spite that angers me; My wife can speak no English, I no Welsh.
3.1.48	My daughter weeps: she will not part with you; She'll be a soldier too, she'll to the wars.
3.1.49	Good father, tell her that she and my aunt Percy Shall follow in your conduct speedily. [Glendower speaks to her in Welsh, and she answers him in the same.
3.1.50	She is desperate here; a peevish self-will'd harlotry, one that no persuasion can do good upon. [The lady speaks in Welsh.
3.1.51	I understand thy looks: that pretty Welsh Which thou pour'st down from these swelling heavens I am too perfect in; and, but for shame, In such a parley should I answer thee. [The lady speaks again in Welsh. I understand thy kisses and thou mine, And that's a feeling disputation: But I will never be a truant, love, Till I have learn'd thy language; for thy tongue Makes Welsh as sweet as ditties highly penn'd, Sung by a fair queen in a summer's bower. With ravishing division, to her lute.
3.1.52	Nay, if you melt, then will she run mad. [The lady speaks again in Welsh.
3.1.53	O, I am ignorance itself in this!
3.1.54	She bids you on the wanton rushes lay you down And rest your gentle head upon her lap, And she will sing the song that pleaseth you And on your eyelids crown the god of sleep, Charming your blood with pleasing heaviness, Making the difference 'twixt wake and sleep As is the difference betwixt day and night The hour before the heavenly-harness'd team Beg'ns his golden progress in the east.
3.1.55	With all my heart I'll sit and hear her sing: By that time will our book, I think, be drawn.
3.1.56	Do so; And those musicians that shall play to you Hang in the air a thousand leagues from hence, And straight they shall be here: sit, and attend.
3.1.57	Come, Kate, thou art perfect in lying down: come, quick, quick, that I may lay my head in thy lap.
3.1.58	Go, ye giddy goose. [The music plays.
3.1.59	Now I perceive the devil understands Welsh; And 'tis no marvel he is so humorous. By 'r lady, he is a good musician.
3.1.60	Then should you be nothing but musical, for you are altogether governed by humours. Lie still, ye thief, and hear the lady sing in Welsh.
3.1.61	I had rather hear Lady, my brach, howl in Irish.
3.1.62	Wouldst thou have thy head broken?
3.1.63	No.
3.1.64	Then be still.
3.1.65	Neither; 'tis a woman's fault.
