1.0.0	ACT I
4.2.9	If I be not ashamed of my soldiers, I am a soused gurnet. I have misused the king's press damnably. I have got, in exchange of a hundred and fifty soldiers, three hundred and odd pounds. I press me none but good householders, yeomen's sons; inquire me out contracted bachelors, such as had been asked twice on the banns; such a commodity of warm slaves, as had as lieve hear the devil as a drum; such as fear the report of a caliver worse than a struck fowl or a hurt wild-duck. I pressed me none but such toasts-and-butter, with hearts in their bellies no bigger than pins' heads, and they have bought out their services; and now my whole charge consists of ancients, corporals, lieutenants, gentlemen of companies, slaves as ragged as Lazarus in the painted cloth, where the glutton's dogs licked his sores; and such as indeed were never soldiers, but discarded unjust serving-men, younger sons to younger brothers, revolted tapsters and ostlers trade-fallen, the cankers of a calm world and a long peace, ten times more dishonourable ragged than an old faced ancient: and such have I, to fill up the rooms of them that have bought out their services, that you would think that I had a hundred and fifty tattered prodigals lately come from swine-keeping, from eating draff and husks. A mad fellow met me on the way and told me I had unloaded all the gibbets and pressed the dead bodies. No eye hath seen such scarcecrows. I'll not march through Coventry with them, that's flat: nay, and the villains march wide betwixt the legs, as if they had gyves on; for indeed I had the most of them out of prison. There's but a shirt and a half in all my company; and the half shirt is two napkins tacked together and thrown over the shoulders like a herald's coat without sleeves; and the shirt, to say the truth, stolen from my host at Saint Alban's, or the red-nose innkeeper of Daventry. But that's all one; they'll find linen enough on every hedge. Enter the PRINCE and WESTMORELAND.
4.2.10	How now, blown Jack! how now, quilt!
4.2.11	What, Hal! how now, mad wag! what a devil dost thou in Warwickshire? My good Lord of Westmoreland, I cry you mercy: I thought your honour had already been at Shrewsbury.
4.2.12	Faith, Sir John, 'tis more than time that I were there, and you too; but my powers are there already. The king, I can tell you, looks for us all: we must away all night.
4.2.13	Tut, never fear me: I am as vigilant as a cat to steal cream.
4.2.14	I think, to steal cream indeed, for thy theft hath already made thee butter. But tell me, Jack, whose fellows are these that come after?
4.2.15	Mine, Hal, mine.
4.2.16	I did never see such pitiful rascals.
4.2.17	Tut, tut; good enough to toss; food for powder, food for powder; they'll fill a pit as well as better: tush, man, mortal men, mortal men.
4.2.18	Ay, but, Sir John, methinks they are exceeding poor and bare, too beggarly.
4.2.19	'Faith, for their poverty, I know not where they had that; and for their bareness, I am sure they never learned that of me.
4.2.20	No, I'll be sworn; unless you call three fingers on the ribs bare. But, sirrah, make haste: Percy is already in the field.
4.2.21	What, is the king encamped?
4.2.22	He is, Sir John: I fear we shall stay too long.
4.2.23	Well, To the latter end of a fray and the beginning of a feast Fits a dull fighter and a keen guest. [Ex]eunt.
4.3.1	The rebel camp near Shrewsbury.
4.3.2	Enter HOTSPUR, WORCESTER, DOUGLAS, and VERNON.
4.3.3	We'll fight with him to-night.
4.3.4	It may not be.
4.3.5	You give him then advantage.
4.3.6	Not a whit.
4.3.7	Why say you so? looks he not for supply?
4.3.8	So do we.
4.3.9	His is certain, ours is doubtful.
4.3.10	Good cousins, be advised; stir not to-night.
4.3.11	Do not, my lord.
4.3.12	You do not counsel well: You speak it out of fear and cold heart.
4.3.13	Do me no slander, Douglas: by my life, And I dare well maintain it with my life, If well-respected honour bid me on, I hold as little counsel with weak fear As you my lord, or any Scot that this day lives: Let it be seen to-morrow in the battle Which of us fears.
4.3.14	Yea, or to-night.
4.3.15	Content.
4.3.16	To-night, say I.
4.3.17	Come, come, it may not be. I wonder much, Being men of such great leading as you are, That you foresee not what impediments Drag back our expedition: certain horse Of my cousin Vernon's are not yet come up: Your uncle Worcester's horse came but today; And now their pride and mettle is asleep, Their courage with hard labour tame and dull, That not a horse is half the half of himself.
4.3.18	So are the horses of the enemy In general, journey-bated and brought low: The better part of ours are full of rest.
4.3.19	The number of the king exceedeth ours: For God's sake, cousin, stay till all come in. [The trumpet sounds a parley. Enter SIR WALTER BLUNT.
4.3.20	I come with gracious offers from the king, If you vouchsafe me hearing and respect.
4.3.21	Welcome, Sir Walter Blunt; and would to God You were of our determination Some of us love you well; and even those some Envy your great deservings and good name, Because you are not of our quality, But stand against us like an enemy.
4.3.22	And God defend but still I should stand so, So long as out of limit and true rule You stand against anointed majesty. But to my charge. The king hath sent to know The nature of your griefs, and whereupon You conjure from the breasts of civil peace Such bold hostility, teaching his duteous land Audacious cruelty. If that the king Have any way your good deserts forgot, Which he confesseth to be manifold, He bids you name your griefs; and with all speed You shall have your desires with interest And pardon absolute for yourself and these Herein misled by your suggestion.
4.3.23	The king is kind; and well we know the king Knows at what time to promise, when to pay. My father and my uncle and myself Did give him that same royalty he wears; And when he was not six and twenty strong Sick in the world's regard, wretched and low, A poor unminded outlaw sneaking home, My father gave him welcome to the shore; And when he heard him swear and vow to God He came but to be Duke of Lancaster, To sue his livery and beg his peace, With tears of innocency and terms of zeal, My father, in kind heart and pity moved, Swore him assistance and perform'd it too. Now when the lords and barons of the realm Perceived Northumberland did lean to him, The more and less came in with cap and knee; Met him in boroughs, cities, villages, Attended him on bridges, stood in lanes, Laid gifts before him, proffer'd him their oaths, Gave him their heirs, as pages follow'd him Even at the heels in golden multitudes. He presently, as greatness knows itself, Steps me a little higher than his vow Made to my father, while his blood was poor, Upon the naked shore at Ravenspurgh; And now, forsooth, takes on him to reform Some certain edicts and some strait decrees That lie too heavy on the commonwealth, Cries out upon abuses, seems to weep Over his country's wrongs; and by this face, This seeming brow of justice, did he win The hearts of all that he did angle for; Proceeded further; cut me off the heads Of all the favourites that the absent king In deputation left behind him here, When he was personal in the Irish war.
4.3.24	Tut, I came not to hear this.
4.3.25	Then to the point. In short time after, he deposed the king; Soon after that, deprived him of his life; And in the neck of that, task'd the whole state; To make that worse, suffer'd his kinsman March, Who is, if every owner were well placed, Indeed his king, to be engaged in Wales, There without ransom to lie forfeited; Disgraced me in my happy victories, Sought to entrap me by intelligence; Rated mine uncle from the council-board; In rage dismiss'd my father from the court; Broke oath on oath, committed wrong on wrong, And in conclusion drove us to seek out This head of safety; and withal to pry Into his title, the which we find Too indirect for long continuance.
4.3.26	Shall I return this answer to the king?
4.3.27	Not so, Sir Walter: we'll withdraw awhile. Go to the king; and let there be impawn'd Some surety for a safe return again, And in the morning early shall my uncle Bring him our purposes: and so farewell.
4.3.28	I would you would accept of grace and love.
4.3.29	And may be so we shall.
4.3.30	Pray God you do. [Ex]eunt.
4.4.1	York. The ARCHBISHOP'S palace.
4.4.2	Enter the ARCHBISHOP OF YORK and SIR MICHAEL.
4.4.3	Hie, good Sir Michael; bear this sealed brief With winged haste to the lord marshal; This is my cousin Scroop, and all the rest To whom they are directed. If you knew How much they do import, you would make haste.
4.4.4	My good lord, I guess their tenour.
4.4.5	Like enough you do. To-morrow, good Sir Michael, is a day Wherein the fortune of ten thousand men Must bide the touch; for, sir, at Shrewsbury, As I am truly given to understand, The king with mighty and quick-raised power Meets with Lord Harry: and I fear, Sir Michael. What with the sickness of Northumberland, Whose power was in the first proportion, And what with Owen Glendower's absence thence, Who with them was a rated sinew too And comes not in, o'er-ruled by prophecies, I fear the power of Percy is too weak To wage an instant trial with the king.
4.4.6	Why, my good lord, you need not fear; There is Douglas and Lord Mortimer.
4.4.7	No. Mortimer is not there.
4.4.8	But there is Mordake, Vernon, Lord Harry Percy, And there is my Lord of Worcester and a head Of gallant warriors, noble gentlemen.
4.4.9	And so there is: but yet the king hath drawn The special head of all the land together: The Prince of Wales, Lord John of Lancaster, The noble Westmoreland and warlike Blunt; And many moe corrivals and dear men Of estimation and command in arms.
4.4.10	Doubt not, my lord, they shall be well opposed.
4.4.11	I hope no less, yet needful 'tis to fear; And, to prevent the worst, Sir Michael, speed: For if Lord Percy thrive not, ere the king Dismiss his power, he means to visit us, For he hath heard of our confederacy, And 'tis but wisdom to make strong against him: Therefore make haste. I must go write again To other friends; and so farewell, Sir Michael. [Ex]eunt.
5.0.0	ACT V
5.1.1	The KING'S camp near Shrewsbury.
5.1.2	Enter the KING, PRINCE OF WALES, LORD JOHN OF LANCASTER, EARL OF WESTMORELAND, SIR WALTER BLUNT, and FALSTAFF.
5.1.3	How bloodily the sun begins to peer Above yon busky hill! the day looks pale At his distemperature.
5.1.4	The southern wind Doth play the trumpet to his purposes, And by his hollow whistling in the leaves Foretells a tempest and a blustering day.
5.1.5	Then with the losers let it sympathise, For nothing can seem foul to those that win. [The trumpet sounds. Enter WORCESTER and VERNON. How now, my Lord of Worcester! 'tis not well That you and I should meet upon such terms As now we meet. You have deceived our trust, And made us doff our easy robes of peace, To crush our old limbs in ungentle steel: This is not well, my lord, this is not well. What say you to it? will you again unknit This churlish knot of all-abhorred war? And move in that obedient orb again Where you did give a fair and natural light, And be no more an exhaled meteor, A prodigy of fear and a portent Of broached mischief to the unborn times?
5.1.6	Hear me, my liege: For mine own part, I could be well content To entertain the lag-end of my life With quiet hours; for I do protest, I have not sought the day of this dislike.
5.1.7	You have not sought it! how comes it then?
5.1.8	Rebellion lay in his way, and he found it.
5.1.9	Peace, chewet, peace!
5.1.10	It pleased your majesty to turn your looks Of favour from myself and all our house; And yet I must remember you, my lord, We were the first and dearest of your friends. For you my staff of office did I break In Richard's time; and posted day and night To meet you on the way, and kiss your hand, When yet you were in place and in account Nothing so strong and fortunate as I. It was myself, my brother and his son, That brought you home and boldly did outdare The dangers of the time. You swore to us, And you did swear that oath at Doncaster, That you did nothing purpose 'gainst the state; Nor claim no further than your new-fall'n right, The seat of Gaunt, dukedom of Lancaster: To this we swore our aid. But in short space It rain'd down fortune showering on your head; And such a flood of greatness fell on you, What with our help, what with the absent king, What with the injuries of a wanton time, The seeming sufferances that you had borne, And the contrarious winds that held the king So long in his unlucky Irish wars That all in England did repute him dead: And from this swarm of fair advantages You took occasion to be quickly woo'd To gripe the general sway into your hand; Forgot your oath to us at Doncaster; And being fed by us you used us so As that ungentle gull, the cuckoo's bird, Useth the sparrow; did oppress our nest; Grew by our feeding to so great a bulk That even our love durst not come near your sight For fear of swallowing; but with nimble wing We were enforced, for safety sake, to fly Out of your sight and raise this present head; Whereby we stand opposed by such means As you yourself have forged against yourself By unkind usage, dangerous countenance, And violation of all faith and troth Sworn to us in your younger enterprise.
5.1.11	These things indeed you have articulate, Proclaim'd at market-crosses, read in churches, To face the garment of rebellion With some fine colour that may please the eye Of fickle changelings and poor discontents, Which gape and rub the elbow at the news Of hurlyburly innovation: And never yet did insurrection want Such water-colours to impaint his cause; Nor moody beggars, starving for a time Of pellmell havoc and confusion.
5.1.12	In both your armies there is many a soul Shall pay full dearly for this encounter, If once they join in trial. Tell your nephew, The Prince of Wales doth join with all the world In praise of Henry Percy: by my hopes, This present enterprise set off his head, I do not think a braver gentleman, More active-valiant or more valiant-young, More daring or more bold, is now alive To grace this latter age with noble deeds. For my part, I may speak it to my shame, I have a truant been to chivalry; And so I hear he doth account me too; Yet this before my father's majesty- I am content that he shall take the odds Of his great name and estimation, And will, to save the blood on either side, Try fortune with him in a single fight.
5.1.13	And Prince of Wales, so dare we venture thee, Albeit considerations infinite Do make against it. No, good Worcester, no, We love our people well; even those we love That are misled upon your cousin's part; And, will they take the offer of our grace, Both he and they and you, yea, every man Shall be my friend again and I'll be his: So tell your cousin, and bring me word What he will do: but if he will not yield, Rebuke and dread correction wait on us And they shall do their office. So, be gone; We will not now be troubled with reply: We offer fair; take it advisedly. [Ex]eunt Worcester and Vernon,
5.1.14	It will not be accepted, on my life: The Douglas and the Hotspur both together Are confident against the world in arms.
5.1.15	Hence, therefore, every leader to his charge; For, on their answer, will we set on them: And God befriend us, as our cause is just! [Ex]eunt all but the Prince of Wales and Falstaff.
5.1.16	Hal, if thou see me down in the battle and bestride me, so; 'tis a point of friendship.
5.1.17	Nothing but a colossus can do thee that friendship. Say thy prayers, and farewell.
5.1.18	I would 'twere bed-time, Hal, and all well.
5.1.19	Why, thou owest God a death. [Ex]it.
5.1.20	'Tis not due yet; I would be loath to pay him before his day. What need I be so forward with him that calls not on me? Well, 'tis no matter; honour pricks me on. Yea, but how if honour prick me off when I come on? how then? Can honour set to a leg? no: or an arm? no: or take away the grief of a wound? no. Honour hath no skill in surgery, then? no. What is honour? a word. What is in that word honour? what is that honour? air. A trim reckoning! Who hath it? he that died o' Wednesday. Doth he feel it? no. Doth he hear it? no. 'Tis insensible, then? Yea, to the dead. But will it not live with the living? no. Why? detraction will not suffer it. Therefore I'll none of it. Honour is a mere scutcheon: and so ends my catechism. [Ex]it.
5.2.1	The rebel camp.
5.2.2	Enter WORCESTER and VERNON.
5.2.3	O, no, my nephew must not know, Sir Richard, The liberal and kind offer of the king.
5.2.4	'Twere best he did.
5.2.5	Then are we all undone. It is not possible, it cannot be, The king should keep his word in loving us; He will suspect us still and find a time To punish this offence in other faults: Suspicion all our lives shall be stuck full of eyes; For treason is but trusted like the fox, Who, ne'er so tame, so cherish'd and lock'd up, Will have a wild trick of his ancestors. Look how we can, or sad or merrily, Interpretation will misquote our looks, And we shall feed like oxen at a stall, The better cherish'd, still the nearer death. My nephew's trespass may be well forgot; It hath the excuse of youth and heat of blood, And an adopted name of privilege, A hare-brain'd Hotspur, govern'd by a spleen: All his offences live upon my head And on his father's; we did train him on, And, his corruption being ta'en from us, We, as the spring of all, shall pay for all. Therefore, good cousin, let not Harry know, In any case, the offer of the king.
5.2.6	Deliver what you will; I'll say 'tis so. Here comes your cousin. Enter HOTSPUR and DOUGLAS.
5.2.7	My uncle is return'd: Deliver up my Lord of Westmoreland. Uncle, what news?
5.2.8	The king will bid you battle presently.
5.2.9	Defy him by the Lord of Westmoreland.
5.2.10	Lord Douglas, go you and tell him so.
5.2.11	Marry, and shall, and very willingly. [Exit.
5.2.12	There is no seeming mercy in the king.
5.2.13	Did you beg any? God forbid!
5.2.14	I told him gently of our grievances, Of his oath-breaking; which he mended thus, By now forswearing that he is forsworn: He calls us rebels, traitors; and will scourge With haughty arms this hateful name in us. Re-enter DOUGLAS.
5.2.15	Arm, gentlemen: to arms! for I have thrown A brave defiance in King Henry's teeth, And Westmoreland, that was engaged, did bear it; Which cannot choose but bring him quickly on.
5.2.16	The Prince of Wales stepp'd forth before the king, And, nephew, challenged you to single fight.
5.2.17	O, would the quarrel lay upon our heads, And that no man might draw short breath to-day But I and Harry Monmouth! Tell me, tell me, How show'd his tasking? seem'd it in contempt?
5.2.18	No, by my soul; I never in my life Did hear a challenge urged more modestly, Unless a brother should a brother dare To gentle exercise and proof of arms. He gave you all the duties of a man; Trimm'd up your praises with a princely tongue, Spoke your deservings like a chronicle, Making you ever better than his praise By still dispraising praise valued with you; And, which became him like a prince indeed, He made a blushing cital of himself; And chid his truant youth with such a grace As if he master'd there a double spirit Of teaching and of learning instantly. There did he pause: but let me tell the world, If he outlive the envy of this day, England did never owe so sweet a hope, So much misconstrued in his wantonness.
5.2.19	Cousin, I think thou art enamoured On his follies: never did I hear Of any prince, so wild a libertine. But be he as he will, yet once ere night I will embrace him with a soldier's arm, That he shall shrink under my courtesy. Arm, arm with speed: and, fellows, soldiers, friends, Better consider what you have to do Than I, that have not well the gift of tongue, Can lift your blood up with persuasion. Enter a Messenger.
5.2.20	My lord, here are letters for you.
5.2.21	I cannot read them now. O gentlemen, the time of life is short! To spend that shortness basely were too long, If life did ride upon a dial's point, Still ending at the arrival of an hour. And if we live, we live to tread on kings; If die, brave death, when princes die with us! Now, for our consciences, the arms are fair, When the intent of bearing them is just. Enter another Messenger.
5.2.22	My lord, prepare; the king comes on apace.
5.2.23	I thank him, that he cuts me from my tale, For I profess not talking; only this— Let each man do his best: and here draw I A sword, whose temper I intend to stain With the best blood that I can meet withal In the adventure of this perilous day. Now, Esperance! Percy! and set on. Sound all the lofty instruments of war, And by that music let us all embrace; For, heaven to earth, some of us never shall A second time do such a courtesy. [The trumpets sound. They embrace, and exeunt.
5.3.1	Plain between the camps.
5.3.2	The KING enters with his power. Alarum to the battle. Then enter DOUGLAS and SIR WALTER BLUNT.
5.3.3	What is thy name, that in the battle thus Thou crossest me? what honour dost thou seek Upon my head?
5.3.4	Know then, my name is Douglas; And I do haunt thee in the battle thus Because some tell me that thou art a king.
5.3.5	They tell thee true.
5.3.6	The Lord of Stafford dear to-day hath bought Thy likeness, for instead of thee, King Harry, This sword hath ended him: so shall it thee, Unless thou yield thee as my prisoner.
5.3.7	I was not born a yielder, thou proud Scot; And thou shalt find a king that will revenge Lord Stafford's death. [They fight. Douglas kills Blunt. Enter HOTSPUR.
5.3.8	O Douglas, hadst thou fought at Holmedon thus, I never had triumph'd upon a Scot.
5.3.9	All's done, all's won; here breathless lies the king.
5.3.10	Where?
5.3.11	Here.
5.3.12	This, Douglas? no: I know this face full well: A gallant knight he was, his name was Blunt; Semblaby furnish'd like the king himself.
5.3.13	A fool go with thy soul, whither it goes! A borrow'd title hast thou bought too dear: Why didst thou tell me that thou wert a king ?
5.3.14	The king hath many marching in his coats.
5.3.15	Now, by my sword, I will kill all his coats; I'll murder all his wardrobe, piece by piece, Until I meet the king.
5.3.16	Up, and away! Our soldiers stand full fairly for the day. [Ex]eunt. Alarum. Enter FALSTAFF, solus.
5.3.17	Though I could 'scape shot-free at London, I fear the shot here; here's no scoring but upon the pate. Soft! who are you? Sir Walter Blunt: there's an honour for you! here's no vanity! I am as hot as molten lead, and as heavy too: God keep lead out of me! I need no more weight than mine own bowels. I have led my ragamuffins where they are peppered; there's not three of my hundred and fifty left alive; and they are for the town's end, to beg during life. But who comes here? Enter the PRINCE.
5.3.18	What, stand'st thou idle here? lend me thy sword: Many a nobleman lies stark and stiff Under the hoofs of vaunting enemies, Whose deaths are yet unrevenged: I prithee, lend me thy sword.
5.3.19	O, Hal, I prithee, give me leave to breathe awhile. Turk Gregory never did such deeds in arms as I have done this day. I have paid Percy, I have made him sure.
5.3.20	He is, indeed; and living to kill thee. I prithee, lend me thy sword.
5.3.21	Nay, before God, Hal, if Percy be alive, thou get'st not my sword; but take my pistol, if thou wilt.
5.3.22	Give it me: what, is it in the case?
5.3.23	Ay, Hal; 'tis hot, 'tis hot; there's that will sack a city. [The Prince draws it out, and finds it to be a bottle of sack.
5.3.24	What, is it a time to jest and dally now? [He throws the bottle at him. Exit.
5.3.25	Well, if Percy be alive, I'll pierce him. If he do come in my way, so: if he do not, if I come in his willingly, let him make a carbonado of me. I like not such grinning honour as Sir Walter hath: give me life: which if I can save, so; if not, honour comes unlooked for, and there's an end. [Ex]it.
5.4.1	Another part of the field.
5.4.2	Alarum. Excursions.
5.4.3	Enter the KING, the PRINCE, LORD JOHN OF LANCASTER, and EARL OF WESTMORELAND.
5.4.4	I prithee, Harry, withdraw thyself; thou bleed'st too much. Lord John of Lancaster, go you with him.
5.4.5	Not I, my lord, unless I did bleed too.
5.4.6	I beseech your majesty, make up, Lest your retirement do amaze your friends.
5.4.7	I will do so. My Lord of Westmoreland, lead him to his tent.
5.4.8	Come, my lord, I'll lead you to your tent.
5.4.9	Lead me, my lord? I do not need your help: And God forbid a shallow scratch should drive The Prince of Wales from such a field as this, Where stain'd nobility lies trodden on, And rebels' arms triumph in massacres!
5.4.10	We breathe too long: come, cousin Westmoreland, Our duty this way lies; for God's sake, come. [Ex]eunt Prince John and Westmoreland.
5.4.11	By God, thou hast deceived me, Lancaster; I did not think thee lord of such a spirit: Before, I loved thee as a brother, John; But now, I do respect thee as my soul.
5.4.12	I saw him hold Lord Percy at the point With lustier maintenance than I did look for Of such an ungrown warrior.
5.4.13	O, this boy Lends mettle to us all! [Ex]it. Enter DOUGLAS.
5.4.14	Another king! they grow like Hydra's heads: I am the Douglas, fatal to all those That wear those colours on them: what art thou, That counterfeit'st the person of a king?
5.4.15	The king himself; who, Douglas, grieves at heart So many of his shadows thou hast met And not the very king. I have two boys Seek Percy and thyself about the field: But, seeing thou fall'st on me so luckily, I will assay thee: so, defend thyself.
5.4.16	I fear thou art another counterfeit; And yet, in faith, thou bear'st thee like a king: But mind I am sure thou art, whoe'er thou be, And thus I win thee. [They fight; the King being in danger, re-enter Prince of Wales.
